title,year,poster,plot
500 Days of Summer,2009,https://m.media-amazon.com/images/M/MV5BMTk5MjM4OTU1OV5BMl5BanBnXkFtZTcwODkzNDIzMw@@._V1_SX300.jpg,"After being dumped by the girl he believes to be his soulmate, hopeless romantic Tom Hansen reflects on their relationship to try and figure out where things went wrong and how he can win her back."
A Walk Among the Tombstones,2014,https://m.media-amazon.com/images/M/MV5BMTQ3NzY2MTg1M15BMl5BanBnXkFtZTgwODY2Njk4MTE@._V1_SX300.jpg,Private investigator Matthew Scudder is hired by a drug kingpin to find out who kidnapped and murdered his wife.
Anywhere But Here,1999,https://m.media-amazon.com/images/M/MV5BNzAxYjVhODctMTAxZS00MGE4LThkNjEtNTExY2FkNWFkZjUyXkEyXkFqcGdeQXVyMjUzOTY1NTc@._V1_SX300.jpg,A mother and daughter search for success in Beverly Hills.
Bernard and Doris,2006,https://m.media-amazon.com/images/M/MV5BZDYwNTA1YWUtM2IwNy00ZjgzLWFjNDAtMzc5OWU3NDZhYzI5XkEyXkFqcGdeQXVyMTU3NDU4MDg2._V1_SX300.jpg,"The story of the twilight years of tobacco billionairess Doris Duke and her relationship with her gay butler, to whom she left her entire fortune."
Como Novio de Pueblo,2019,https://m.media-amazon.com/images/M/MV5BMzBhMjVjZTktYzgwNy00ODIyLTgxNzAtN2QyNTlkODQwYmU5XkEyXkFqcGdeQXVyOTU3NDE4NzQ@._V1_SX300.jpg,"After getting left at the altar, Diego gets to be taken away by his cousins on a vacation to their childhood town to Puerto Vallarta to overcome his heartbreak."
Doc Hollywood,1991,https://m.media-amazon.com/images/M/MV5BNTcwMjZlZTgtM2VlMC00MDZkLWIzODQtMDRhZjE0N2QzMTgwXkEyXkFqcGdeQXVyMjY3MjUzNDk@._V1_SX300.jpg,A young doctor on his way across the country to a job interview crashes his car in a small town and is sentenced to work for several days at the town hospital.
Downsizing,2017,https://m.media-amazon.com/images/M/MV5BNDYxNDQ5OTYxOV5BMl5BanBnXkFtZTgwOTcyODkxNDM@._V1_SX300.jpg,"A social satire in which a man realizes he would have a better life if he were to shrink himself to five inches tall, allowing him to live in wealth and splendor."
Fiddler on the Roof,1971,https://m.media-amazon.com/images/M/MV5BODQ5NGUzMzQtZTJjZC00MTk0LThjNmMtYzRjMjI1YTZiNmM5XkEyXkFqcGdeQXVyMjUzOTY1NTc@._V1_SX300.jpg,"In pre-revolutionary Russia, a Jewish peasant with traditional values contends with marrying off three of his daughters with modern romantic ideals while growing anti-Semitic sentiment threatens his village."
Flightplan,2005,https://m.media-amazon.com/images/M/MV5BMDgxNzUzNGQtODk5Yy00YTJjLThlMTgtMjRlYjQ2ZGFlYzlkXkEyXkFqcGc@._V1_SX300.jpg,"A bereaved woman and her daughter are flying home from Berlin to America. At 30,000 feet, the child vanishes, and nobody will admit she was ever on the plane."
Funny Farm,1988,https://m.media-amazon.com/images/M/MV5BM2MyNmQ2ZTQtYzE1Ni00MWQwLWE3ZTctMDcxOWE4ZTQzMjE5L2ltYWdlL2ltYWdlXkEyXkFqcGdeQXVyNzc5MjA3OA@@._V1_SX300.jpg,"A couple swap city life for the country, but their picturesque new hometown turns out to be just a little bit different to what they were expecting."
Get Smart,2008,https://m.media-amazon.com/images/M/MV5BMTY0NzQ4MDU0NV5BMl5BanBnXkFtZTcwMzA2NzQ2MQ@@._V1_SX300.jpg,"Maxwell Smart, a highly intellectual but bumbling spy working for the CONTROL agency, is tasked with preventing a terrorist attack from rival spy agency KAOS."
Gorky Park,1983,https://m.media-amazon.com/images/M/MV5BNWYyZGVmMDQtYjljYi00NTU2LWEwYWEtZmQyNDMxMTRiY2VhXkEyXkFqcGdeQXVyMjI4MjA5MzA@._V1_SX300.jpg,A Moscow police officer investigates a vicious triple homicide and stumbles upon a high-level international political conspiracy.
Green Zone,2010,https://m.media-amazon.com/images/M/MV5BMTYzMTA1NDMyNV5BMl5BanBnXkFtZTcwMzUwODY5Mg@@._V1_SX300.jpg,Discovering covert and faulty intelligence causes a U.S. Army officer to go rogue as he hunts for Weapons of Mass Destruction in an unstable region.
Heartbreakers,2001,https://m.media-amazon.com/images/M/MV5BMTQ2NjE3NjQzOF5BMl5BanBnXkFtZTcwMDIwOTA0NA@@._V1_SX300.jpg,A mother and daughter con team seduce and scam wealthy men.
High Heels and Low Lifes,2001,https://m.media-amazon.com/images/M/MV5BYjVhOTkzMzItNGZkZC00MjE2LTg0YzctZTY2OGEzZDFjMmQwXkEyXkFqcGdeQXVyMTMxMTY0OTQ@._V1_SX300.jpg,A nurse eavesdrops with a friend on a cell phone conversation that describes a bank heist. She and the friend then conspire to blackmail the robbers for two million dollars.
House of Flying Daggers,2004,https://m.media-amazon.com/images/M/MV5BZDExZGI3MjMtN2VkNi00MzY2LWEwY2ItZTdiYzgwOGVlOWYyXkEyXkFqcGdeQXVyMTcwOTQzOTYy._V1_SX300.jpg,"A romantic police captain breaks a beautiful member of a rebel group out of prison to help her rejoin her fellows, but things are not what they seem."
House of Sand and Fog,2003,https://m.media-amazon.com/images/M/MV5BMTIzMjQ5NzM2M15BMl5BanBnXkFtZTYwMzU2NDY3._V1_SX300.jpg,An abandoned wife is evicted from her house and starts a tragic conflict with her house's new owners.
Jason Bourne,2016,https://m.media-amazon.com/images/M/MV5BZjk0ZWMwNWItZjUwYy00NzgwLWFiOWMtNmRhYzEyZjhhYzgyXkEyXkFqcGdeQXVyMTcwOTQzOTYy._V1_SX300.jpg,The CIA's most dangerous former operative is drawn out of hiding to uncover more explosive truths about his past.
Jumper,2008,https://m.media-amazon.com/images/M/MV5BMmFmYWVhMjYtMzMzNi00ZWQ0LTlkNGEtNTg3NmViNWFkM2QzXkEyXkFqcGdeQXVyMjQwMjk0NjI@._V1_SX300.jpg,A young man with teleportation abilities suddenly finds himself in the middle of an ancient war between those like him and their sworn annihilators.
Kingsman: The Golden Circle,2017,https://m.media-amazon.com/images/M/MV5BMjQ3OTgzMzY4NF5BMl5BanBnXkFtZTgwOTc4OTQyMzI@._V1_SX300.jpg,"After the Kingsman's headquarters is destroyed and the world is held hostage, an allied spy organization in the United States is discovered. These two elite secret agencies must band together to defeat a common enemy."
Kingsman: The Secret Service,2014,https://m.media-amazon.com/images/M/MV5BYTM3ZTllNzItNTNmOS00NzJiLTg1MWMtMjMxNDc0NmJhODU5XkEyXkFqcGdeQXVyODE5NzE3OTE@._V1_SX300.jpg,"A spy organisation recruits a promising street kid into the agency's training program, while a global threat emerges from a twisted tech genius."
Les Misérables,2012,https://m.media-amazon.com/images/M/MV5BNWZhNGM1ZTItYTg4Zi00MTE2LTg5MjYtYjdmYmZkNTVmYTQwXkEyXkFqcGdeQXVyMTMxODk2OTU@._V1_SX300.jpg,"In 19th-century France, Jean Valjean, who, for decades, has been hunted by the ruthless policeman Javert after breaking parole, agrees to care for a factory worker's daughter. The decision changes their lives forever."
Les Misérables,2012,https://m.media-amazon.com/images/M/MV5BNWZhNGM1ZTItYTg4Zi00MTE2LTg5MjYtYjdmYmZkNTVmYTQwXkEyXkFqcGdeQXVyMTMxODk2OTU@._V1_SX300.jpg,"In 19th-century France, Jean Valjean, who, for decades, has been hunted by the ruthless policeman Javert after breaking parole, agrees to care for a factory worker's daughter. The decision changes their lives forever."
Little Buddha,1993,https://m.media-amazon.com/images/M/MV5BZjU2MWM4NjctYTRlYi00MzBiLWI1NmItMmE4ODdlOGZmMTcyXkEyXkFqcGdeQXVyMjUzOTY1NTc@._V1_SX300.jpg,"After the death of Lama Dorje, Tibetan Buddhist monks find three children - one American and two Nepalese - who may be the rebirth of their great teacher."
Mad Max: Fury Road,2015,https://m.media-amazon.com/images/M/MV5BN2EwM2I5OWMtMGQyMi00Zjg1LWJkNTctZTdjYTA4OGUwZjMyXkEyXkFqcGdeQXVyMTMxODk2OTU@._V1_SX300.jpg,"In a post-apocalyptic wasteland, a woman rebels against a tyrannical ruler in search for her homeland with the aid of a group of female prisoners, a psychotic worshipper and a drifter named Max."
Murder on the Orient Express,2017,https://m.media-amazon.com/images/M/MV5BMTk5OGFiYzktMTkwNS00ZjQ5LWFkNGQtNGM0MjA4MWE2MDIwXkEyXkFqcGdeQXVyODY1NDk1NjE@._V1_SX300.jpg,"When a murder occurs on the train on which he's travelling, celebrated detective Hercule Poirot is recruited to solve the case."
Noah,2014,https://m.media-amazon.com/images/M/MV5BMjI2OTgyNTc0Ml5BMl5BanBnXkFtZTgwNDM1NTQxMTE@._V1_SX300.jpg,Noah is chosen by God to undertake a momentous mission before an apocalyptic flood cleanses the world.
Non-Stop,2014,https://m.media-amazon.com/images/M/MV5BOTI3NzcxMjkzMl5BMl5BanBnXkFtZTgwMDY0NTQ0MDE@._V1_SX300.jpg,"An air marshal springs into action during a transatlantic flight after receiving a series of text messages demanding $150 million into an off-shore account, or someone will die every 20 minutes."
Ocean's Eleven,2001,https://m.media-amazon.com/images/M/MV5BYzVmYzVkMmUtOGRhMi00MTNmLThlMmUtZTljYjlkMjNkMjJkXkEyXkFqcGdeQXVyNDk3NzU2MTQ@._V1_SX300.jpg,"Danny Ocean, a gangster, rounds up a gang of associates to stage a sophisticated and elaborate casino heist which involves robbing three Las Vegas casinos simultaneously during a popular boxing event."
Ocean's Eleven,2001,https://m.media-amazon.com/images/M/MV5BYzVmYzVkMmUtOGRhMi00MTNmLThlMmUtZTljYjlkMjNkMjJkXkEyXkFqcGdeQXVyNDk3NzU2MTQ@._V1_SX300.jpg,"Danny Ocean, a gangster, rounds up a gang of associates to stage a sophisticated and elaborate casino heist which involves robbing three Las Vegas casinos simultaneously during a popular boxing event."
Ocean's Thirteen,2007,https://m.media-amazon.com/images/M/MV5BMTMyNTc1NzY5MV5BMl5BanBnXkFtZTcwNDM4NTQzMw@@._V1_SX300.jpg,"Danny Ocean rounds up the boys for a third heist after casino owner Willy Bank double-crosses one of the original eleven, Reuben Tishkoff."
Ocean's Twelve,2004,https://m.media-amazon.com/images/M/MV5BMmJmYzBjNTktMTJjZS00ZGRhLWE1Y2QtOWQxZGU0Y2RmMjkyXkEyXkFqcGdeQXVyMTQxNzMzNDI@._V1_SX300.jpg,Daniel Ocean recruits one more team member so he can pull off three major European heists in this sequel to Ocean's Eleven (2001).
Paul Blart: Mall Cop,2009,https://m.media-amazon.com/images/M/MV5BMTM2NzA1MzE1NF5BMl5BanBnXkFtZTcwOTYyNDIzMg@@._V1_SX300.jpg,"When a shopping mall is taken over by a gang of organized crooks, it's up to a mild-mannered security guard to save the day."
Pixels,2015,https://m.media-amazon.com/images/M/MV5BMTIzNDYzMzgtZWMzNS00ODc2LTg2ZmMtOTE2MWZkNzIxMmQ0XkEyXkFqcGdeQXVyNjQ3MDg0MTY@._V1_SX300.jpg,"When aliens misinterpret video feeds of classic arcade games as a declaration of war, they attack the Earth in the form of the video games."
Point of No Return,1993,https://m.media-amazon.com/images/M/MV5BNzMwY2I3YmEtYWI1Ny00MjQyLThiNDUtZWI2NTI5YjJjZjY5XkEyXkFqcGdeQXVyNjQ2MjQ5NzM@._V1_SX300.jpg,A government fakes the death of a criminal to turn this young woman into a killer on its service.
Proof of Life,2000,https://m.media-amazon.com/images/M/MV5BMTMyODkwNzM3OV5BMl5BanBnXkFtZTYwMTc5Nzc5._V1_SX300.jpg,"Alice hires a professional negotiator to obtain the release of her engineer husband, who has been kidnapped by anti-government guerrillas in South America."
Shopgirl,2005,https://m.media-amazon.com/images/M/MV5BMjE2MTM5NjIyOV5BMl5BanBnXkFtZTcwOTg3NDAzMQ@@._V1_SX300.jpg,"A film adaptation of Steve Martin's novel about a complex love triangle between a bored salesgirl, a wealthy businessman and an aimless young man."
Shot Through the Heart,1998,https://m.media-amazon.com/images/M/MV5BZDQ5MjAyZGMtZTlmYi00ZjQyLTk5MjItNzYyOTJmNWJlNjQ2XkEyXkFqcGdeQXVyNTE1NjY5Mg@@._V1_SX300.jpg,"The horrors of war are examined from the view points of lifelong friends, who end up on opposing sides in the war in Sarajevo. One is an expert marksman, who trains the snipers used to terrify the city and the other becomes a free..."
Taken 2,2012,https://m.media-amazon.com/images/M/MV5BMTkwNTQ0ODExOV5BMl5BanBnXkFtZTcwNjU3NDQwOA@@._V1_SX300.jpg,"In Istanbul, retired CIA operative Bryan Mills and his wife are taken hostage by the father of a kidnapper Mills killed while rescuing his daughter."
Taken 3,2014,https://m.media-amazon.com/images/M/MV5BNjM5MDU3NTY0M15BMl5BanBnXkFtZTgwOTk2ODU2MzE@._V1_SX300.jpg,"Accused of a ruthless murder he never committed or witnessed, Bryan Mills goes on the run and brings out his particular set of skills to find the true killer and clear his name."
The Bourne Identity,2002,https://m.media-amazon.com/images/M/MV5BM2JkNGU0ZGMtZjVjNS00NjgyLWEyOWYtZmRmZGQyN2IxZjA2XkEyXkFqcGdeQXVyNTIzOTk5ODM@._V1_SX300.jpg,"A man is picked up by a fishing boat, bullet-riddled and suffering from amnesia, before racing to elude assassins and attempting to regain his memory."
The Bourne Supremacy,2004,https://m.media-amazon.com/images/M/MV5BYTIyMDFmMmItMWQzYy00MjBiLTg2M2UtM2JiNDRhOWE4NjBhXkEyXkFqcGdeQXVyNjU0OTQ0OTY@._V1_SX300.jpg,"When Jason Bourne is framed for a CIA operation gone awry, he is forced to resume his former life as a trained assassin to survive."
The Bourne Ultimatum,2007,https://m.media-amazon.com/images/M/MV5BNGNiNmU2YTMtZmU4OS00MjM0LTlmYWUtMjVlYjAzYjE2N2RjXkEyXkFqcGdeQXVyNDk3NzU2MTQ@._V1_SX300.jpg,Jason Bourne dodges a ruthless C.I.A. official and his Agents from a new assassination program while searching for the origins of his life as a trained killer.
The Hard Way,1991,https://m.media-amazon.com/images/M/MV5BYTQ0MGQ0MmQtOWVjMy00NTFkLWFlYjUtYTVmNmFjNmFmOWY4XkEyXkFqcGdeQXVyMjUzOTY1NTc@._V1_SX300.jpg,"An action movie star researching a role is allowed to tag along with a hardboiled New York City policeman, who finds him superficial and irritating."
The Ides of March,2011,https://m.media-amazon.com/images/M/MV5BNTU4MjkzNTY0OF5BMl5BanBnXkFtZTcwNDI5ODIxNg@@._V1_SX300.jpg,An idealistic staffer for a new presidential candidate gets a crash course on dirty politics during his stint on the campaign trail.
The Informant!,2009,https://m.media-amazon.com/images/M/MV5BMTgyNjE1OTc4Ml5BMl5BanBnXkFtZTgwNjc4MTA3MjI@._V1_SX300.jpg,"The U.S. government decides to go after an agro-business giant with a price-fixing accusation, based on the evidence submitted by their star witness, vice president-turned-informant Mark Whitacre."
The Italian Job,2003,https://m.media-amazon.com/images/M/MV5BNDYyNzYxNjYtNmYzMC00MTE0LWIwMmYtNTAyZDBjYTIxMTRhXkEyXkFqcGdeQXVyNDk3NzU2MTQ@._V1_SX300.jpg,"After being betrayed and left for dead in Italy, Charlie Croker and his team plan an elaborate gold heist against their former ally."
The Judge,2014,https://m.media-amazon.com/images/M/MV5BMTcyNzIxOTIwMV5BMl5BanBnXkFtZTgwMzE0NjQwMjE@._V1_SX300.jpg,"Big-city lawyer Hank Palmer returns to his childhood home where his father, the town's judge, is suspected of murder. Hank sets out to discover the truth; along the way he reconnects with his estranged family."
The Notebook,2004,https://m.media-amazon.com/images/M/MV5BNzc3Mzg1OGYtZjc3My00Y2NhLTgyOWUtYjRhMmI4OTkwNDg4XkEyXkFqcGdeQXVyMTU3NDU4MDg2._V1_SX300.jpg,An elderly man reads to a woman with dementia the story of two young lovers whose romance is threatened by the difference in their respective social classes.
The Rainmaker,1997,https://m.media-amazon.com/images/M/MV5BN2YwYjVjMDAtMTk0Ni00YjkzLTg0YjgtZDM0MzUyNjJiNzE2XkEyXkFqcGdeQXVyMTcwMTM1NTY0._V1_SX300.jpg,An underdog lawyer takes on a fraudulent insurance company.
The Thomas Crown Affair,1999,https://m.media-amazon.com/images/M/MV5BMmU0N2RiNTAtN2U4MS00MWExLTkzNGYtOTVhNmVmZmNlOTUzXkEyXkFqcGdeQXVyNDk3NzU2MTQ@._V1_SX300.jpg,"A very rich and successful playboy amuses himself by stealing artwork, but may have met his match in a seductive detective."
Thick as Thieves,1999,https://m.media-amazon.com/images/M/MV5BMTc4MTAwMTI2N15BMl5BanBnXkFtZTcwNzMwOTYyMQ@@._V1_SX300.jpg,"A thief is betrayed after a well done job in Detroit. Returning to Chicago, he decides on revenge. Things escalate."
Trading Places,1983,https://m.media-amazon.com/images/M/MV5BZGVjNTBiYWUtY2MwOC00NTg1LWJiNWMtNzM5MTBkYzE5NjQxXkEyXkFqcGdeQXVyMTUzMDUzNTI3._V1_SX300.jpg,A snobbish investor and a wily street con artist find their positions reversed as part of a bet by two callous millionaires.
Unknown,2011,https://m.media-amazon.com/images/M/MV5BODA4NTk3MTQwN15BMl5BanBnXkFtZTcwNjUwMTMxNA@@._V1_SX300.jpg,"When a man awakens from a coma only to discover that someone has taken on his identity, he teams up with a young woman to prove who he is."
