title,year,poster,plot
A Walk Among the Tombstones,2014,https://m.media-amazon.com/images/M/MV5BMTQ3NzY2MTg1M15BMl5BanBnXkFtZTgwODY2Njk4MTE@._V1_SX300.jpg,Private investigator Matthew Scudder is hired by a drug kingpin to find out who kidnapped and murdered his wife.
Como Novio de Pueblo,2019,https://m.media-amazon.com/images/M/MV5BMzBhMjVjZTktYzgwNy00ODIyLTgxNzAtN2QyNTlkODQwYmU5XkEyXkFqcGdeQXVyOTU3NDE4NzQ@._V1_SX300.jpg,"After getting left at the altar, Diego gets to be taken away by his cousins on a vacation to their childhood town to Puerto Vallarta to overcome his heartbreak."
Downsizing,2017,https://m.media-amazon.com/images/M/MV5BNDYxNDQ5OTYxOV5BMl5BanBnXkFtZTgwOTcyODkxNDM@._V1_SX300.jpg,"A social satire in which a man realizes he would have a better life if he were to shrink himself to five inches tall, allowing him to live in wealth and splendor."
Get Smart,2008,https://m.media-amazon.com/images/M/MV5BMTY0NzQ4MDU0NV5BMl5BanBnXkFtZTcwMzA2NzQ2MQ@@._V1_SX300.jpg,"Maxwell Smart, a highly intellectual but bumbling spy working for the CONTROL agency, is tasked with preventing a terrorist attack from rival spy agency KAOS."
Green Zone,2010,https://m.media-amazon.com/images/M/MV5BMTYzMTA1NDMyNV5BMl5BanBnXkFtZTcwMzUwODY5Mg@@._V1_SX300.jpg,Discovering covert and faulty intelligence causes a U.S. Army officer to go rogue as he hunts for Weapons of Mass Destruction in an unstable region.
House of Flying Daggers,2004,https://m.media-amazon.com/images/M/MV5BZDExZGI3MjMtN2VkNi00MzY2LWEwY2ItZTdiYzgwOGVlOWYyXkEyXkFqcGdeQXVyMTcwOTQzOTYy._V1_SX300.jpg,"A romantic police captain breaks a beautiful member of a rebel group out of prison to help her rejoin her fellows, but things are not what they seem."
Jumper,2008,https://m.media-amazon.com/images/M/MV5BMmFmYWVhMjYtMzMzNi00ZWQ0LTlkNGEtNTg3NmViNWFkM2QzXkEyXkFqcGdeQXVyMjQwMjk0NjI@._V1_SX300.jpg,A young man with teleportation abilities suddenly finds himself in the middle of an ancient war between those like him and their sworn annihilators.
Kingsman: The Secret Service,2014,https://m.media-amazon.com/images/M/MV5BYTM3ZTllNzItNTNmOS00NzJiLTg1MWMtMjMxNDc0NmJhODU5XkEyXkFqcGdeQXVyODE5NzE3OTE@._V1_SX300.jpg,"A spy organisation recruits a promising street kid into the agency's training program, while a global threat emerges from a twisted tech genius."
Mad Max: Fury Road,2015,https://m.media-amazon.com/images/M/MV5BN2EwM2I5OWMtMGQyMi00Zjg1LWJkNTctZTdjYTA4OGUwZjMyXkEyXkFqcGdeQXVyMTMxODk2OTU@._V1_SX300.jpg,"In a post-apocalyptic wasteland, a woman rebels against a tyrannical ruler in search for her homeland with the aid of a group of female prisoners, a psychotic worshipper and a drifter named Max."
Non-Stop,2014,https://m.media-amazon.com/images/M/MV5BOTI3NzcxMjkzMl5BMl5BanBnXkFtZTgwMDY0NTQ0MDE@._V1_SX300.jpg,"An air marshal springs into action during a transatlantic flight after receiving a series of text messages demanding $150 million into an off-shore account, or someone will die every 20 minutes."
Ocean's Eleven,2001,https://m.media-amazon.com/images/M/MV5BYzVmYzVkMmUtOGRhMi00MTNmLThlMmUtZTljYjlkMjNkMjJkXkEyXkFqcGdeQXVyNDk3NzU2MTQ@._V1_SX300.jpg,"Danny Ocean, a gangster, rounds up a gang of associates to stage a sophisticated and elaborate casino heist which involves robbing three Las Vegas casinos simultaneously during a popular boxing event."
Ocean's Eleven,2001,https://m.media-amazon.com/images/M/MV5BYzVmYzVkMmUtOGRhMi00MTNmLThlMmUtZTljYjlkMjNkMjJkXkEyXkFqcGdeQXVyNDk3NzU2MTQ@._V1_SX300.jpg,"Danny Ocean, a gangster, rounds up a gang of associates to stage a sophisticated and elaborate casino heist which involves robbing three Las Vegas casinos simultaneously during a popular boxing event."
Ocean's Thirteen,2007,https://m.media-amazon.com/images/M/MV5BMTMyNTc1NzY5MV5BMl5BanBnXkFtZTcwNDM4NTQzMw@@._V1_SX300.jpg,"Danny Ocean rounds up the boys for a third heist after casino owner Willy Bank double-crosses one of the original eleven, Reuben Tishkoff."
Ocean's Twelve,2004,https://m.media-amazon.com/images/M/MV5BMmJmYzBjNTktMTJjZS00ZGRhLWE1Y2QtOWQxZGU0Y2RmMjkyXkEyXkFqcGdeQXVyMTQxNzMzNDI@._V1_SX300.jpg,Daniel Ocean recruits one more team member so he can pull off three major European heists in this sequel to Ocean's Eleven (2001).
Paul Blart: Mall Cop,2009,https://m.media-amazon.com/images/M/MV5BMTM2NzA1MzE1NF5BMl5BanBnXkFtZTcwOTYyNDIzMg@@._V1_SX300.jpg,"When a shopping mall is taken over by a gang of organized crooks, it's up to a mild-mannered security guard to save the day."
Taken 2,2012,https://m.media-amazon.com/images/M/MV5BMTkwNTQ0ODExOV5BMl5BanBnXkFtZTcwNjU3NDQwOA@@._V1_SX300.jpg,"In Istanbul, retired CIA operative Bryan Mills and his wife are taken hostage by the father of a kidnapper Mills killed while rescuing his daughter."
Taken 3,2014,https://m.media-amazon.com/images/M/MV5BNjM5MDU3NTY0M15BMl5BanBnXkFtZTgwOTk2ODU2MzE@._V1_SX300.jpg,"Accused of a ruthless murder he never committed or witnessed, Bryan Mills goes on the run and brings out his particular set of skills to find the true killer and clear his name."
The Ides of March,2011,https://m.media-amazon.com/images/M/MV5BNTU4MjkzNTY0OF5BMl5BanBnXkFtZTcwNDI5ODIxNg@@._V1_SX300.jpg,An idealistic staffer for a new presidential candidate gets a crash course on dirty politics during his stint on the campaign trail.
The Informant!,2009,https://m.media-amazon.com/images/M/MV5BMTgyNjE1OTc4Ml5BMl5BanBnXkFtZTgwNjc4MTA3MjI@._V1_SX300.jpg,"The U.S. government decides to go after an agro-business giant with a price-fixing accusation, based on the evidence submitted by their star witness, vice president-turned-informant Mark Whitacre."
The Judge,2014,https://m.media-amazon.com/images/M/MV5BMTcyNzIxOTIwMV5BMl5BanBnXkFtZTgwMzE0NjQwMjE@._V1_SX300.jpg,"Big-city lawyer Hank Palmer returns to his childhood home where his father, the town's judge, is suspected of murder. Hank sets out to discover the truth; along the way he reconnects with his estranged family."
The Notebook,2004,https://m.media-amazon.com/images/M/MV5BNzc3Mzg1OGYtZjc3My00Y2NhLTgyOWUtYjRhMmI4OTkwNDg4XkEyXkFqcGdeQXVyMTU3NDU4MDg2._V1_SX300.jpg,An elderly man reads to a woman with dementia the story of two young lovers whose romance is threatened by the difference in their respective social classes.
The Thomas Crown Affair,1999,https://m.media-amazon.com/images/M/MV5BMmU0N2RiNTAtN2U4MS00MWExLTkzNGYtOTVhNmVmZmNlOTUzXkEyXkFqcGdeQXVyNDk3NzU2MTQ@._V1_SX300.jpg,"A very rich and successful playboy amuses himself by stealing artwork, but may have met his match in a seductive detective."
Thick as Thieves,1999,https://m.media-amazon.com/images/M/MV5BMTc4MTAwMTI2N15BMl5BanBnXkFtZTcwNzMwOTYyMQ@@._V1_SX300.jpg,"A thief is betrayed after a well done job in Detroit. Returning to Chicago, he decides on revenge. Things escalate."
Trading Places,1983,https://m.media-amazon.com/images/M/MV5BZGVjNTBiYWUtY2MwOC00NTg1LWJiNWMtNzM5MTBkYzE5NjQxXkEyXkFqcGdeQXVyMTUzMDUzNTI3._V1_SX300.jpg,A snobbish investor and a wily street con artist find their positions reversed as part of a bet by two callous millionaires.
Unknown,2011,https://m.media-amazon.com/images/M/MV5BODA4NTk3MTQwN15BMl5BanBnXkFtZTcwNjUwMTMxNA@@._V1_SX300.jpg,"When a man awakens from a coma only to discover that someone has taken on his identity, he teams up with a young woman to prove who he is."
